Bug ID,Product,Component,Assignee,Status,Resolution,Summary,Changed,Priority,Severity,Opened
1446721,Firefox,Tabbed Browser,constfilin,RESOLVED,FIXED,Replace parent.removeChild(element) with element.remove() in tabbrowser.js,5/18/2018 2:03,P3,normal,3/18/2018 0:28
1351690,Firefox,PDF Viewer,continuation,RESOLVED,FIXED,Lazily load pdf.js in the content process,6/5/2018 6:59,P3,normal,3/29/2017 7:45
1436184,Firefox,General,continuation,RESOLVED,FIXED,"Remove definitions of Ci, Cr, Cc, and Cu from httpd.js and .sjs files",2/9/2018 2:18,P3,normal,2/6/2018 13:36
1383217,Firefox,Tabbed Browser,dao+bmo,RESOLVED,FIXED,Make favicons more pronounced in ctrl+tab previews,10/17/2018 0:32,P3,enhancement,7/21/2017 12:26
1394188,Firefox,Tabbed Browser,dao+bmo,RESOLVED,FIXED,Tab titles should not display hostname on reload,12/18/2018 6:30,P3,normal,8/26/2017 21:56
1422478,Firefox,Theme,dao+bmo,RESOLVED,FIXED,Regression: The New Tab Button is overlapped by the new tab during a tabcreation,1/14/2018 7:27,P3,normal,12/2/2017 0:32
1429288,Firefox,Theme,dao+bmo,RESOLVED,FIXED,[Linux] addon permissions alert is unreadable when using dark-background themes,1/15/2018 16:33,P3,major,1/9/2018 20:50
1429929,Firefox,Tabbed Browser,dao+bmo,RESOLVED,FIXED,"Remove ""tabbrowser-close-tab-button"" binding",1/14/2018 14:24,P3,normal,1/11/2018 14:22
1430457,Firefox,Theme,dao+bmo,RESOLVED,FIXED,Stop using -moz-border-top-colors for the lwtheme faux window border on Windows 7,1/16/2018 8:02,P3,normal,1/14/2018 3:02
1430872,Firefox,General,dao+bmo,RESOLVED,FIXED,Stop wrapping the whole browser window in a deck (remove tab-view-deck and browser-panel),1/25/2018 5:09,P3,normal,1/16/2018 12:03
1436361,Firefox,Tabbed Browser,dao+bmo,RESOLVED,FIXED,Extract the async tab switcher from tabbrowser.js into its own JSM,3/6/2018 6:05,P3,normal,2/7/2018 6:44
1437052,Firefox,Theme,dao+bmo,RESOLVED,FIXED,Focused item in menu bar has incorrect highlight color with a high-contrast theme set in Windows,11/13/2018 5:30,P3,normal,2/9/2018 6:40
1441102,Firefox,Theme,dao+bmo,RESOLVED,FIXED,Replace --titlebar-text-color with a class,6/10/2018 11:15,P3,normal,2/26/2018 2:11
1442564,Firefox,Tabbed Browser,dao+bmo,RESOLVED,FIXED,"Load tabbrowser.js in browser.xul, not global-scripts.inc",11/22/2018 4:55,P3,normal,3/2/2018 3:32
1442960,Firefox,Tabbed Browser,dao+bmo,RESOLVED,FIXED,Remove workaround for bug 1438504 after bug 1439875,7/9/2018 8:21,P3,normal,3/3/2018 22:05
1443462,Firefox,Tabbed Browser,dao+bmo,RESOLVED,FIXED,Set attributes for the initial browser and subsequent browsers in one place,3/16/2018 2:54,P3,normal,3/6/2018 3:35
1443837,Firefox,Tabbed Browser,dao+bmo,RESOLVED,FIXED,"Set the ""hasadjacentnewtabbutton"" attribute in the tabbrowser-tabs binding rather than gBrowser",3/7/2018 16:24,P3,normal,3/7/2018 8:39
1445671,Firefox,Theme,dao+bmo,RESOLVED,FIXED,Blurry text in focused tab using Dark Theme,5/24/2018 6:29,P3,normal,3/14/2018 9:26
1446332,Firefox,Tabbed Browser,dao+bmo,RESOLVED,FIXED,Remove const nsI* from tabbrowser.js,3/16/2018 11:04,P3,normal,3/16/2018 4:28
1449689,Firefox,Theme,dao+bmo,RESOLVED,FIXED,Merge updateTitlebarDisplay function into TabsInTitlebar.update,3/29/2018 15:13,P3,normal,3/28/2018 11:46
1462281,Firefox,Tabbed Browser,dao+bmo,RESOLVED,FIXED,Remove obsolete getNotificationBox function form browser.js,5/22/2018 14:40,P3,normal,5/17/2018 2:13
1463685,Firefox,Theme,dao+bmo,RESOLVED,FIXED,Investigate increasing the panel header font-weight,5/24/2018 17:06,P3,normal,5/23/2018 2:12
1465401,Firefox,Tabbed Browser,dao+bmo,RESOLVED,FIXED,setTabTitle shouldn't wrap data URI shortening in try/catch,6/1/2018 15:07,P3,normal,5/30/2018 4:43
1465497,Firefox,Toolbars and Customization,dao+bmo,RESOLVED,FIXED,Title bar and drag space text in customize mode with dark theme can't be read on hovering,7/11/2018 6:37,P3,normal,5/30/2018 8:02
1468992,Firefox,Bookmarks & History,dao+bmo,RESOLVED,FIXED,Remove the Library infopane More/Less toggle,6/30/2018 3:03,P3,normal,6/15/2018 9:25
1473309,Firefox,Tabbed Browser,dao+bmo,RESOLVED,FIXED,Move TabContextMenu and stray usercontext-related functions from browser.js to tabbrowser.js,7/7/2018 14:55,P3,normal,7/4/2018 6:41
1474586,Firefox,Keyboard Navigation,dao+bmo,RESOLVED,FIXED,"The content area context menu items Copy Link Location and Copy Email Address have different access keys, and its annoying: can we change the latter to match the former?",7/23/2018 8:50,P3,normal,7/10/2018 6:08
1478635,Firefox,Tabbed Browser,dao+bmo,RESOLVED,FIXED,Remove _createBrowser's 'remote' parameter,7/28/2018 2:53,P3,normal,7/26/2018 5:47
1484422,Firefox,Theme,dao+bmo,RESOLVED,FIXED,Clean up fullscreen window controls styling,8/21/2018 15:06,P3,normal,8/18/2018 0:58
1485256,Firefox,Theme,dao+bmo,RESOLVED,FIXED,Use photon red for the fullscreen window close button,8/22/2018 10:29,P3,normal,8/21/2018 22:37
1490617,Firefox,General,dao+bmo,RESOLVED,FIXED,CaptivePortalWatcher reads the captivedetect.portalRecheckDelayMS pref before being initialized,9/13/2018 17:21,P3,normal,9/12/2018 2:37
1490627,Firefox,General,dao+bmo,RESOLVED,FIXED,browser-captivePortal.js leaks cps variable into the browser window's global scope,11/21/2018 5:51,P3,normal,9/12/2018 3:01
1492417,Firefox,Keyboard Navigation,dao+bmo,RESOLVED,FIXED,Remove Browser:Home command,9/19/2018 9:52,P3,normal,9/19/2018 3:47
1492841,Firefox,Address Bar,dao+bmo,RESOLVED,FIXED,Add tab icon for switch-to-tab UrlbarView results,9/27/2018 2:20,P3,normal,9/20/2018 6:18
1494690,Firefox,Address Bar,dao+bmo,RESOLVED,FIXED,Set the right maxResults in UrlbarInput,9/28/2018 21:22,P3,normal,9/27/2018 7:47
1496443,Firefox,Address Bar,dao+bmo,RESOLVED,FIXED,Add test for UrlbarInput tooltip behavior,11/6/2018 4:16,P3,normal,10/4/2018 7:36
1497469,Firefox,Address Bar,dao+bmo,RESOLVED,FIXED,Dispatch the ValueChange event from UrlbarInput,10/22/2018 1:44,P3,normal,10/9/2018 2:51
1498878,Firefox,Address Bar,dao+bmo,RESOLVED,FIXED,Implement UrlbarInput::goButton,10/22/2018 1:35,P3,normal,10/14/2018 0:30
1500086,Firefox,Address Bar,dao+bmo,RESOLVED,FIXED,"UrlbarInput: While typing, show the Go button and hide the history dropmarker",10/20/2018 4:14,P3,normal,10/18/2018 5:56
1500136,Firefox,General,dao+bmo,RESOLVED,FIXED,gStoragePressureObserver should use openTrustedLinkIn,10/20/2018 3:14,P3,normal,10/18/2018 8:12
1500959,Firefox,Tabbed Browser,dao+bmo,RESOLVED,FIXED,Fix todo_is in browser_visibleTabs_tabPreview.js,10/25/2018 9:35,P3,normal,10/22/2018 8:19
1501996,Firefox,Address Bar,dao+bmo,RESOLVED,FIXED,Move browser_urlbarTrimURLs.js to browser/components/urlbar/tests/browser/,12/21/2018 8:30,P3,normal,10/25/2018 4:33
1505319,Firefox,Theme,dao+bmo,RESOLVED,FIXED,Remove --cfr-notification-header-image and --cfr-notification-footer-star variables,11/14/2018 1:56,P3,normal,11/7/2018 2:32
1505324,Firefox,Theme,dao+bmo,RESOLVED,FIXED,Remove redundant compacttheme.css rules on Linux,11/7/2018 8:25,P3,normal,11/7/2018 3:05
1505847,Firefox,Theme,dao+bmo,RESOLVED,FIXED,"Find bar buttons are rectangular, border-radius fails to apply",11/13/2018 7:09,P3,normal,11/8/2018 9:44
1506063,Firefox,Tabbed Browser,dao+bmo,RESOLVED,FIXED,Simplify gDragSpaceObserver,11/9/2018 9:50,P3,normal,11/9/2018 2:05
1506068,Firefox,General,dao+bmo,RESOLVED,FIXED,Stop calling gAccessibilityServiceIndicator.update from uninit,11/9/2018 13:54,P3,normal,11/9/2018 2:15
1506112,Firefox,Toolbars and Customization,dao+bmo,RESOLVED,FIXED,Replace customize-context-autoHide class with meaningful id,11/13/2018 10:05,P3,normal,11/9/2018 5:28
1506123,Firefox,Toolbars and Customization,dao+bmo,RESOLVED,FIXED,Remove unused toolbaritem-tabsmenu class,11/10/2018 2:02,P3,normal,11/9/2018 6:01
1506341,Firefox,Theme,dao+bmo,RESOLVED,FIXED,[Linux] Window controls appear to move up when showing the autohiding menu bar,11/30/2018 14:10,P3,normal,11/10/2018 1:41
1508585,Firefox,Search,dao+bmo,RESOLVED,FIXED,Load search-one-offs.js lazily,11/20/2018 13:46,P3,normal,11/20/2018 1:41
1508590,Firefox,Search,dao+bmo,RESOLVED,FIXED,Load searchbar.js from browser.xul rather than global-scripts.inc,11/22/2018 4:55,P3,normal,11/20/2018 2:07
1508603,Firefox,Tabbed Browser,dao+bmo,RESOLVED,FIXED,Move FAVICON_DEFAULTS and TabProgressListener outside the global scope,11/26/2018 16:34,P3,normal,11/20/2018 3:34
1508963,Firefox,Site Identity and Permission Panels,dao+bmo,RESOLVED,FIXED,Load browser-siteIdentity.js lazily,11/21/2018 13:46,P3,normal,11/21/2018 2:13
1508979,Firefox,General,dao+bmo,RESOLVED,FIXED,global-scope pollution from browser-plugins.js,11/24/2018 1:52,P3,normal,11/21/2018 3:03
1509309,Firefox,General,dao+bmo,RESOLVED,FIXED,Move most browser-*.js scripts from global-scripts.inc to browser.xul,11/28/2018 5:11,P3,normal,11/22/2018 4:55
1509323,Firefox,Theme,dao+bmo,RESOLVED,FIXED,Make gDragSpaceObserver private,11/23/2018 13:44,P3,normal,11/22/2018 6:25
1509651,Firefox,General,dao+bmo,RESOLVED,FIXED,Stop flushing style for knowing the UI direction,11/29/2018 10:40,P3,normal,11/24/2018 7:52
1510412,Firefox,General,dao+bmo,RESOLVED,FIXED,Set RTL_UI based on Services.locale.isAppLocaleRTL,11/28/2018 20:35,P3,normal,11/27/2018 12:23
1510414,Firefox,Tabbed Browser,dao+bmo,RESOLVED,FIXED,Use RTL_UI throughout tabbrowser.xml,11/28/2018 20:35,P3,normal,11/27/2018 12:31
1510418,Firefox,Tabbed Browser,dao+bmo,RESOLVED,FIXED,Use TelemetryStopwatch.running instead of custom _tabSwitchStopWatchRunning flag,11/28/2018 13:51,P3,normal,11/27/2018 12:41
1510462,Firefox,General,dao+bmo,RESOLVED,FIXED,browser.js defines AddonManager twice,11/28/2018 4:23,P3,normal,11/27/2018 14:59
1511112,Firefox,General,dao+bmo,RESOLVED,FIXED,Remove remaining style flushes for getting the UI direction in browser/,12/18/2018 11:12,P3,normal,11/29/2018 10:40
1511496,Firefox,Theme,dao+bmo,RESOLVED,FIXED,[Windows 10] Window controls appear to move up when showing the autohiding menu bar,12/3/2018 13:56,P3,normal,11/30/2018 14:10
1513508,Firefox,General,dao+bmo,RESOLVED,FIXED,Clean up Object.defineProperty calls in browser.js,12/12/2018 14:03,P3,normal,12/12/2018 3:56
1514151,Firefox,General,dao+bmo,RESOLVED,FIXED,Consistently use arrow functions and destructuring assignments in XPCOMUtils.defineLazyGetter calls from browser.js,12/14/2018 18:57,P3,normal,12/14/2018 2:02
1514512,Firefox,Address Bar,dao+bmo,RESOLVED,FIXED,"Stop setting sizetopopup=""pref"" on the urlbar",12/18/2018 9:41,P3,normal,12/15/2018 10:09
1516556,Firefox,Theme,dao+bmo,RESOLVED,FIXED,Dark and Light themes should ignore Windows 10 setting for accent color when in high contrast mode,12/28/2018 1:33,P3,normal,12/27/2018 10:09
1455570,Firefox,Sync,dave.hunt,RESOLVED,FIXED,Build and publish TPS add-on,5/4/2018 10:39,P3,normal,4/20/2018 3:06
1363169,Firefox,Menus,dharvey,RESOLVED,FIXED,"Add support for native Windows ""Share"" feature",12/13/2018 8:59,P3,normal,5/8/2017 13:13
1457425,Firefox,Site Identity and Permission Panels,dharvey,RESOLVED,FIXED,[meta] Frontend work for block autoplay,11/8/2018 0:10,P3,normal,4/27/2018 4:28
1474716,Firefox,Site Identity and Permission Panels,dkeeler,RESOLVED,FIXED,"An https PDF opened in a new tab is called as ""Not Secure"", respectively the padlock icon is missing",11/25/2018 19:36,P3,normal,7/10/2018 13:51
1344129,Firefox,Sync,dorelbarbu96,RESOLVED,FIXED,Spacing touchups in about:preferences#sync for regression caused by use of sync-illustration.svg in bug 1228478,3/29/2018 13:39,P3,normal,3/2/2017 21:55
1421703,Firefox,Migration,dothayer,RESOLVED,FIXED,Investigate apparent XPConnect cost in calling nsNavHistory observers with onVisit,1/14/2018 10:39,P3,normal,11/29/2017 9:38
1426245,Firefox,Migration,dothayer,RESOLVED,FIXED,"Replace nsINavBookmarksService::onItemAdded with ""page-bookmarked""",12/4/2018 18:35,P3,normal,12/19/2017 13:48
1426721,Firefox,Migration,dothayer,RESOLVED,FIXED,Avoid blocking main thread when importing logins,1/27/2018 2:01,P3,normal,12/21/2017 10:45
1432529,Firefox,Migration,dothayer,RESOLVED,FIXED,Exit spinEventLoopUntil(...) when canceling out of migrator wizard,2/17/2018 1:58,P3,normal,1/23/2018 9:20
1448944,Firefox,Tabbed Browser,dothayer,RESOLVED,FIXED,Avoid ContentPrefService roundtrip when loading initial about:blank,4/28/2018 10:32,P3,normal,3/26/2018 10:04
1465106,Firefox,Tabbed Browser,dothayer,RESOLVED,FIXED,Disable tab layer cache while issues are hammered out,6/1/2018 2:50,P3,normal,5/29/2018 8:33
1011480,Firefox,Sync,dr.kartikeynrc,RESOLVED,FIXED,Replace laterTickResolvingPromise by Async.promiseYield/jankYielder,9/24/2018 14:24,P3,normal,5/16/2014 5:51
1278640,Firefox,Normandy Server,dthorn,RESOLVED,FIXED,Run update_actions during deploy,1/27/2018 11:11,P3,normal,6/7/2016 11:38
1370997,Firefox,Normandy Server,dthorn,RESOLVED,FIXED,Run update_product_details and initial_data during deploy,1/27/2018 11:11,P3,normal,6/7/2017 11:33
1439721,Firefox,Site Identity and Permission Panels,dvabhinav31,RESOLVED,FIXED,Remove WEB_PERMISSION_CLEARED telemetry code,3/26/2018 8:42,P3,normal,2/20/2018 12:32
1447950,Firefox,Tabbed Browser,dwlsalmeida,RESOLVED,FIXED,Use switch statement in AsyncTabSwitcher.handleEvent,3/24/2018 2:47,P3,normal,3/22/2018 4:21
1482498,Firefox,Bookmarks & History,e7358d9c,RESOLVED,FIXED,Replace mozMatchesSelector usage with matches in browser-places.js,8/21/2018 9:14,P3,normal,8/10/2018 12:58
444420,Firefox,Sync,edilee,RESOLVED,FIXED,real time activity log viewer,9/24/2018 14:26,P3,enhancement,7/9/2008 13:16
518146,Firefox,Sync,edilee,RESOLVED,FIXED,Generate shorter GUIDs than nsIUUIDGenerator,9/24/2018 14:24,P3,normal,9/22/2009 10:26
519911,Firefox,Sync,edilee,RESOLVED,FIXED,Last Update: context status info has grown to epic proportions,9/24/2018 14:26,P3,enhancement,9/30/2009 23:26
533207,Firefox,Sync,edilee,RESOLVED,FIXED,wyciwyg:// URLs should not be synced as-is,9/24/2018 14:24,P3,normal,12/6/2009 15:55
1383599,Firefox,Activity Streams: Newtab,edilee,RESOLVED,FIXED,browser.newtabpage.enabled = false is not working,10/3/2018 10:31,P3,normal,7/23/2017 19:10
1421823,Firefox,Activity Streams: Newtab,edilee,RESOLVED,FIXED,Green up our JS dependencies,2/6/2018 11:49,P3,normal,11/29/2017 15:02
1426266,Firefox,Activity Streams: Newtab,edilee,RESOLVED,FIXED,Enable or disable new eslint rules,6/17/2018 18:44,P3,normal,12/19/2017 15:26
1440421,Firefox,Activity Streams: Newtab,edilee,RESOLVED,FIXED,Mirror https://github.com/mozilla/activity-stream repository layout in browser/extensions/activity-stream,6/8/2018 5:08,P3,enhancement,2/22/2018 10:45
1358120,Firefox,Sync,eglassercamp,RESOLVED,FIXED,"""Missing Authorization Token"" error during sync",9/22/2018 9:24,P3,normal,4/20/2017 5:58
1440779,Firefox,Normandy Client,eglassercamp,RESOLVED,FIXED,Implement preference-experiment action as an internal action,12/21/2018 5:39,P3,normal,2/23/2018 12:56
1474384,Firefox,Tabbed Browser,ehsan,RESOLVED,FIXED,<xul:browser>.currentURI for lazy browsers is very eager to allocate nsIURI objects,7/13/2018 1:57,P3,normal,7/9/2018 11:46
1480899,Firefox,Tracking Protection,ehsan,RESOLVED,FIXED,Tracking resources should not have access granted when when window.open called with noopener option,8/15/2018 11:10,P3,normal,8/3/2018 13:53
1484788,Firefox,Tracking Protection,ehsan,RESOLVED,FIXED,Make the Disable Protection button in the control centre UI work for third-party cookie blocking settings,9/14/2018 9:09,P3,normal,8/20/2018 11:50
1493060,Firefox,Tracking Protection,ehsan,RESOLVED,FIXED,Convert an overly aggressive assertion into a runtime check,9/25/2018 2:26,P3,normal,9/20/2018 20:21
1493211,Firefox,Tracking Protection,ehsan,RESOLVED,FIXED,network.cookie.cookieBehavior == 4 breaks serviceworker interception for doubly(+) nested iframes,9/28/2018 14:32,P3,normal,9/21/2018 9:19
1512276,Firefox,Site Identity and Permission Panels,ehsan,RESOLVED,FIXED,Remove the waitForSecurityChange() defined in browser_trackingUI_animation_2.js,12/5/2018 20:07,P3,normal,12/5/2018 11:31
1445737,Firefox,Tabbed Browser,emilio,RESOLVED,FIXED,"TabsInTitlebar initialization looks suspicious, and probably causes perf issues.",3/23/2018 6:55,P3,normal,3/14/2018 12:17
1451256,Firefox,General,emilio,RESOLVED,FIXED,Remove extends from toolbarpaletteitem.,7/7/2018 17:23,P3,normal,4/4/2018 2:16
1243103,Firefox,New Tab Page,enndeakin,RESOLVED,FIXED,"Intermittent browser_newtab_drag_drop_ext.js | grid status = 99p,0,1,2,3,4,5,7p,8p - Got ,0,1,2,3,4,5,7p,8p, expected 99p,0,1,2,3,4,5,7p,8p",9/22/2018 7:32,P3,normal,1/26/2016 12:03
1462418,Firefox,Preferences,evilpies,RESOLVED,FIXED,Delete key functionality in the Cookies and Site Data Manager,9/7/2018 11:19,P3,normal,5/17/2018 10:55
1448918,Firefox,General,ewright,RESOLVED,FIXED,Migrate Firefox Desktop's first run experience from a web page to an in-product experience,12/25/2018 0:22,P3,normal,3/26/2018 8:59
1409054,Firefox,Activity Streams: Newtab,felipc,RESOLVED,FIXED,Properly get rid of old about:home,7/9/2018 14:09,P3,enhancement,10/16/2017 8:36
1462673,Firefox,Theme,felipc,RESOLVED,FIXED,Only load LightWeightThemeWebInstallListener when necessary,5/29/2018 9:32,P3,normal,5/18/2018 7:52
1467593,Firefox,Enterprise Policies,felipc,RESOLVED,FIXED,Invalid URL in PopupBlocking (or any policy) shouldn't cause entire policy not to apply,8/16/2018 6:56,P3,normal,6/7/2018 14:10
1490810,Firefox,General,felipc,RESOLVED,FIXED,Simulate Fission for browser actors by blocking them from receiving subframe events,11/8/2018 12:09,P3,normal,9/12/2018 13:38
1493984,Firefox,General,felipc,RESOLVED,FIXED,Simulate Fission API for communicating between parent and children processes,11/8/2018 12:09,P3,normal,9/25/2018 7:42
1499883,Firefox,Tabbed Browser,felipc,RESOLVED,FIXED,1.41ms uninterruptible reflow at onxbldragend@chrome://browser/content/tabbrowser.xml:1825:15,10/24/2018 11:54,P3,normal,10/17/2018 15:02
1501761,Firefox,Tabbed Browser,felipc,RESOLVED,FIXED,Land reflow test for tab detaching,10/25/2018 10:31,P3,normal,10/24/2018 10:30
1427973,Firefox,Preferences,fischer.json,RESOLVED,FIXED,Should track the origins of `openPreferences` from mozscreenshots and urlbarBindings.xml,1/11/2018 14:01,P3,normal,1/3/2018 23:34
976544,Firefox,General,florian,RESOLVED,FIXED,"Intermittent browser_get_user_media.js,browser_devices_get_user_media.js | Unexpected Exception: TypeError: PopupNotifications.panel.firstChild is null or Test timed out",1/5/2018 8:31,P3,normal,2/25/2014 6:20
1220246,Firefox,Search,florian,RESOLVED,FIXED,"Intermittent test_geodefaults.js | should_get_geo_defaults_only_once - [should_get_geo_defaults_only_once : 104] ""undefined"" == ""number""",1/5/2018 8:31,P3,normal,10/30/2015 11:31
1394914,Firefox,Toolbars and Customization,florian,RESOLVED,FIXED,"sidebar-button image is loaded after some delay, causing it to go from blank to an icon",1/29/2018 13:08,P3,normal,8/29/2017 11:25
1406413,Firefox,Session Restore,florian,RESOLVED,FIXED,TypeError: gBrowser.tabContainer is undefined every time the browser is closed (seen only in debug),1/26/2018 2:07,P3,normal,10/6/2017 8:27
1433175,Firefox,General,florian,RESOLVED,FIXED,Mass replace the remaining Components.interface/Components.utils uses with Ci/Cu,5/22/2018 19:13,P3,normal,1/25/2018 9:50
1444969,Firefox,Preferences,francesco.lodolo,RESOLVED,FIXED,Fluent: home-page-header was migrated using the wrong string,3/13/2018 4:21,P3,normal,3/12/2018 11:00
1415733,Firefox,Preferences,gandalf,RESOLVED,FIXED,"Migrate the ""Search"" section of Preferences to the new Localization API",3/16/2018 5:28,P3,normal,11/8/2017 16:28
1419547,Firefox,Preferences,gandalf,RESOLVED,FIXED,"Migrate the ""Containers"" section of Preferences to the new Localization API",4/11/2018 14:07,P3,normal,11/21/2017 12:52
1420761,Firefox,Preferences,gandalf,RESOLVED,FIXED,Handle new localization API in Preferences Search,7/18/2018 8:39,P3,normal,11/26/2017 12:40
1435912,Firefox,Preferences,gandalf,RESOLVED,FIXED,Migrate Preferences::General XUL to .ftl,4/11/2018 14:41,P3,normal,2/5/2018 16:49
1438375,Firefox,Preferences,gandalf,RESOLVED,FIXED,"Refactor ""extensionControlled"" Preferences code to use Fluent",4/27/2018 11:45,P3,normal,2/14/2018 15:34
1445084,Firefox,Preferences,gandalf,RESOLVED,FIXED,Migrate search results pane of Preferences to Fluent,4/9/2018 5:04,P3,normal,3/12/2018 16:26
1445694,Firefox,Preferences,gandalf,RESOLVED,FIXED,"Migrate the ""Sync"" section of Preferences to the new Localization API",4/5/2018 3:28,P3,normal,3/14/2018 10:24
1453540,Firefox,Preferences,gandalf,RESOLVED,FIXED,Migrate the remaining DTD entries to FTL,4/19/2018 2:57,P3,normal,4/11/2018 19:37
1453800,Firefox,Preferences,gandalf,RESOLVED,FIXED,Move the container removal dialog strings to preferences.ftl,4/14/2018 16:46,P3,normal,4/12/2018 14:14
1457021,Firefox,Preferences,gandalf,RESOLVED,FIXED,Migrate the JS of Preferences subdialogs to Fluent,5/19/2018 9:49,P3,normal,4/25/2018 16:26
1457948,Firefox,Preferences,gandalf,RESOLVED,FIXED,Migrate in-content/privacy.js to Fluent,5/28/2018 6:18,P3,normal,4/30/2018 9:22
1243398,Firefox,New Tab Page,gbrown,RESOLVED,FIXED,"Intermittent browser_newtab_undo.js | grid status = 5p,1,2,4,6,7,8 - Got 5p,0,1,2,4,6,7, expected 5p,1,2,4,6,7,8",9/22/2018 7:32,P3,normal,1/27/2016 7:57
1275963,Firefox,Address Bar,gbrown,RESOLVED,FIXED,Intermittent browser_bug556061.js | Found an unexpected tab at the end of test run: about:blank,11/2/2018 6:01,P3,normal,5/26/2016 9:36
962248,Firefox,Toolbars and Customization,gijskruitbosch+bugs,RESOLVED,FIXED,Intermittent browser_934951_zoom_in_toolbar.js | Uncaught exception - Condition timed out: (function () {,8/27/2018 0:44,P3,normal,1/21/2014 13:27
1384657,Firefox,Pocket,gijskruitbosch+bugs,RESOLVED,FIXED,Pocket doesn't work with privacy.firstparty.isolate set to true,12/28/2018 1:33,P3,normal,7/26/2017 10:23
1408044,Firefox,General,gijskruitbosch+bugs,RESOLVED,FIXED,Stop shipping about:,9/25/2018 21:03,P3,normal,10/12/2017 8:49
1433133,Firefox,Activity Streams: Newtab,gijskruitbosch+bugs,RESOLVED,FIXED,Make Activity Stream the only built in page for Home and New Tab,3/9/2018 19:53,P3,normal,1/25/2018 7:44
1434167,Firefox,Migration,gijskruitbosch+bugs,RESOLVED,FIXED,Remove getSourceHomePageURL from migrator code,2/9/2018 8:56,P3,minor,1/29/2018 20:21
1434281,Firefox,Migration,gijskruitbosch+bugs,RESOLVED,FIXED,test_refresh_firefox.py doesn't clean-up cache folder of created profile,8/2/2018 14:54,P3,normal,1/30/2018 7:08
1438367,Firefox,Activity Streams: Newtab,gijskruitbosch+bugs,RESOLVED,FIXED,Make about:home and about:newtab use the same nsIAboutModule flags,6/24/2018 19:16,P3,normal,2/14/2018 15:09
1438499,Firefox,General,gijskruitbosch+bugs,RESOLVED,FIXED,Quitting Firefox doesn't suface the closing confirmation,12/12/2018 3:13,P3,normal,2/15/2018 4:59
1445728,Firefox,Toolbars and Customization,gijskruitbosch+bugs,RESOLVED,FIXED,New Tab icon doesn't get put next to tabs when inserted after the (CSS-moved) titlebar placeholder,12/11/2018 4:08,P3,normal,3/14/2018 11:49
1457469,Firefox,Menus,gijskruitbosch+bugs,RESOLVED,FIXED,Firefox's application menu on Windows lacks key annotation,4/28/2018 10:33,P3,normal,4/27/2018 7:20
1499092,Firefox,General,gijskruitbosch+bugs,RESOLVED,FIXED,Move registerProtocolHandler code out of browser/components/feeds/,12/18/2018 20:42,P3,normal,10/15/2018 8:32
1502982,Firefox,General,gijskruitbosch+bugs,RESOLVED,FIXED,Fix focus event listeners to be capture-phase so as to capture focus of something in the window (fixes browser_354894_perwindowpb.js ),10/30/2018 2:44,P3,normal,10/29/2018 12:16
1503050,Firefox,General,gijskruitbosch+bugs,RESOLVED,FIXED,browser_auto_close_window.js should actually wait for the window to open before cancelling the request,11/12/2018 7:25,P3,normal,10/29/2018 15:39
1503205,Firefox,General,gijskruitbosch+bugs,RESOLVED,FIXED,browser_firstPartyIsolation.js should do a better job of waiting for windows and cleaning up after itself so it passes with --verify,10/30/2018 15:15,P3,normal,10/30/2018 3:09
1511819,Firefox,Preferences,gijskruitbosch+bugs,RESOLVED,FIXED,Reduce confusion in about:preferences when enabling session restore and disabling tab close warning prompts,12/18/2018 0:59,P3,normal,12/3/2018 5:28
1343510,Firefox,Tours,giorgos,RESOLVED,FIXED,Expose profile/session timestamps/times in UITour.getConfiguration for snippets on about:home,1/18/2018 10:10,P3,normal,3/1/2017 4:40
1388502,Firefox,Tabbed Browser,guptatrisha97,RESOLVED,FIXED,List All Tabs dropdown should use a document fragment to populate list,3/20/2018 13:09,P3,normal,8/8/2017 13:22
1451412,Firefox,Preferences,guptatrisha97,RESOLVED,FIXED,Use a documentFragment to build the site data list,5/25/2018 3:11,P3,normal,4/4/2018 10:13
1463748,Firefox,Security,guptatrisha97,RESOLVED,FIXED,Fork and pref-off the new error pages,7/6/2018 13:42,P3,normal,5/23/2018 7:18
1463755,Firefox,Security,guptatrisha97,RESOLVED,FIXED,Update the design of certificate error pages,7/11/2018 15:56,P3,normal,5/23/2018 7:31
1463759,Firefox,Security,guptatrisha97,RESOLVED,FIXED,Change the copy of certificate error pages,8/31/2018 14:18,P3,normal,5/23/2018 7:34
1488788,Firefox,General,haiders2,RESOLVED,FIXED,Use fluent for about:restartrequired,11/5/2018 14:50,P3,normal,9/5/2018 8:06
442871,Firefox,Sync,hello,RESOLVED,FIXED,wizard: no indication the captcha is loading,9/24/2018 14:26,P3,normal,7/1/2008 1:37
1434229,Firefox,Tabbed Browser,hemantsingh1612,RESOLVED,FIXED,Improve test coverage for dragging and dropping tabs,4/24/2018 14:54,P3,normal,1/30/2018 3:20
1501234,Firefox,General,hereissophie,RESOLVED,FIXED,gAccessibilityServiceIndicator should use openTrustedLinkIn,12/18/2018 6:12,P3,normal,10/23/2018 3:37
1410818,Firefox,Activity Streams: Newtab,icrisan,RESOLVED,FIXED,"Add automated test for ""Hover over Top Sites tiles""",3/1/2018 13:45,P3,normal,10/23/2017 1:49
