Bug ID,Product,Component,Assignee,Status,Resolution,Summary,Changed,Priority,Severity,Opened
1493367,Firefox,Activity Streams: Newtab,usarracini,RESOLVED,FIXED,Upstream changes to mozILocaleService,9/26/2018 6:51,P1,normal,9/21/2018 23:48
1495546,Firefox,Activity Streams: Newtab,usarracini,RESOLVED,FIXED,Localization fails in OnboardingMessageProvider if we've already localized strings before,10/3/2018 15:12,P1,normal,10/1/2018 13:04
1496428,Firefox,Activity Streams: Newtab,usarracini,RESOLVED,FIXED,Turn new simplified onboarding experience on for everyone,10/7/2018 22:31,P1,normal,10/4/2018 6:58
1496447,Firefox,Activity Streams: Newtab,usarracini,RESOLVED,FIXED,Unpaired #else in firefox.js,10/4/2018 15:38,P1,normal,10/4/2018 7:43
1496721,Firefox,Activity Streams: Newtab,usarracini,RESOLVED,FIXED,Flip the pref to turn simplified onboarding on,10/11/2018 21:01,P1,enhancement,10/5/2018 6:14
1497967,Firefox,Activity Streams: Newtab,usarracini,RESOLVED,FIXED,Add Opt-out flow for users to stop seeing CFR recommendations,10/21/2018 14:44,P1,enhancement,10/10/2018 11:30
1498378,Firefox,Activity Streams: Newtab,usarracini,RESOLVED,FIXED,Actually remove the old onboarding add-on's prefs,10/15/2018 15:24,P1,normal,10/11/2018 14:11
1502140,Firefox,Activity Streams: Newtab,usarracini,RESOLVED,FIXED,Land FxA Onboarding Card Strings,10/25/2018 21:49,P1,enhancement,10/25/2018 11:44
1503688,Firefox,Activity Streams: Newtab,usarracini,RESOLVED,FIXED,Remove the Amazon Assistant CFR metadata,11/7/2018 8:28,P1,normal,10/31/2018 13:27
1503947,Firefox,Activity Streams: Newtab,usarracini,RESOLVED,FIXED,Add a function to FxAccountsConfig to return the correct url for onboarding fxa card,11/1/2018 15:31,P1,enhancement,11/1/2018 10:15
1357114,Firefox,General,wiwang,RESOLVED,FIXED,"WindowsJumpLists.jsm refreshes itself every 2 minutes or so via a timer, kicking off a Places query and a list building activity that can cause us to skip a frame",5/14/2018 3:34,P1,normal,4/17/2017 9:11
1365970,Firefox,Session Restore,wiwang,RESOLVED,FIXED,Move sessionrestore data collector timer in the content process to idle dispatch,5/14/2018 3:34,P1,normal,5/18/2017 8:15
1366213,Firefox,Session Restore,wiwang,RESOLVED,FIXED,Make the observer is called way less often in SessionCookies.jsm,5/14/2018 3:34,P1,normal,5/19/2017 3:08
1477525,Firefox,General,xidorn+moz,RESOLVED,FIXED,The new bar while stay in place in full screen if you press CTRL + T,11/26/2018 11:51,P1,normal,7/21/2018 19:24
1447173,Firefox,Sync,1991manish.kumar,RESOLVED,FIXED,Sync should only log output installed addons in error logs at trace level,4/3/2018 15:02,P2,normal,3/19/2018 16:35
1471350,Firefox,Activity Streams: Newtab,a.hillier,RESOLVED,FIXED,"Add ""Top Frecent Sites"" to AS Router targeting",9/7/2018 10:43,P2,enhancement,6/26/2018 13:03
1471351,Firefox,Activity Streams: Newtab,a.hillier,RESOLVED,FIXED,Create page visit trigger for CFR experiment,8/2/2018 2:15,P2,enhancement,6/26/2018 13:10
1472000,Firefox,Activity Streams: Newtab,a.hillier,RESOLVED,FIXED,Support pref-based enabling/disabling of messages/providers for AS Router experiments,10/19/2018 6:36,P2,enhancement,6/28/2018 13:49
1479021,Firefox,Activity Streams: Newtab,a.hillier,RESOLVED,FIXED,Add support for URL-based parameters in provider endpoint,9/10/2018 2:31,P2,enhancement,7/27/2018 9:14
1484996,Firefox,Activity Streams: Newtab,a.hillier,RESOLVED,FIXED,Add weight to ASR,9/26/2018 6:46,P2,enhancement,8/21/2018 6:33
1490508,Firefox,Activity Streams: Newtab,a.hillier,RESOLVED,FIXED,CSS mask not applied correctly when recommendation is expanded and url bar text is selected,10/5/2018 15:06,P2,normal,9/11/2018 15:41
1478652,Firefox,Tabbed Browser,ablayelyfondou,RESOLVED,FIXED,removeTabs passes bogus options object to removeTab,7/28/2018 2:53,P2,normal,7/26/2018 6:34
1458119,Firefox,Session Restore,agashlin,RESOLVED,FIXED,Automated test for shutdown/restore with Restart Manager fails in debug,6/29/2018 1:11,P2,normal,4/30/2018 18:18
1454745,Firefox,General,aklotz,RESOLVED,FIXED,Skeletal bootstrap process,5/8/2018 5:54,P2,normal,4/17/2018 12:15
1461921,Firefox,Tracking Protection,amarchesini,RESOLVED,FIXED,Block storage access for third-parties on the tracking protection list,7/17/2018 10:45,P2,normal,5/16/2018 3:24
1473718,Firefox,Address Bar,amarchesini,RESOLVED,FIXED,A Containered tab opens 2 connections to a server.,7/13/2018 15:25,P2,normal,7/5/2018 13:49
1485492,Firefox,Tracking Protection,amarchesini,RESOLVED,FIXED,Disable fastblocking when the user has interacted with a document,9/3/2018 1:36,P2,normal,8/22/2018 13:59
1446975,Firefox,Sync,amy_yyc,RESOLVED,FIXED,Synced Tabs sidebar device icons should match those in page action menu,4/14/2018 7:49,P2,normal,3/19/2018 7:08
1402654,Firefox,Activity Streams: Newtab,andrei.br92,RESOLVED,FIXED,Allow custom image / thumbnail for an edited top site,5/8/2018 7:24,P2,enhancement,9/23/2017 20:06
1421844,Firefox,Activity Streams: Newtab,andrei.br92,RESOLVED,FIXED,Add implementation to Activity Stream mochitests/head.js,1/18/2018 6:36,P2,normal,11/29/2017 16:19
1424987,Firefox,Activity Streams: Newtab,andrei.br92,RESOLVED,FIXED,Many http requests to our SAP webshop by firefox 57 users,2/5/2018 23:28,P2,normal,12/13/2017 4:15
1428720,Firefox,Activity Streams: Newtab,andrei.br92,RESOLVED,FIXED,Use headless mode for running unit tests,1/11/2018 8:38,P2,enhancement,1/8/2018 0:54
1433209,Firefox,Activity Streams: Newtab,andrei.br92,RESOLVED,FIXED,Remove unused strings to simplify translating,4/13/2018 13:02,P2,normal,1/25/2018 11:35
1433215,Firefox,Activity Streams: Newtab,andrei.br92,RESOLVED,FIXED,Add message center blocklist,4/27/2018 11:50,P2,enhancement,1/25/2018 11:49
1433219,Firefox,Activity Streams: Newtab,andrei.br92,RESOLVED,FIXED,Message data format,4/27/2018 11:50,P2,enhancement,1/25/2018 11:51
1442067,Firefox,Activity Streams: Newtab,andrei.br92,RESOLVED,FIXED,Several megabytes of stack related strings in about:newtab,5/3/2018 10:15,P2,normal,2/28/2018 15:26
1450964,Firefox,Activity Streams: Newtab,andrei.br92,RESOLVED,FIXED,Message center admin missing CSS variables,4/7/2018 10:00,P2,enhancement,4/3/2018 6:36
1462114,Firefox,Activity Streams: Newtab,andrei.br92,RESOLVED,FIXED,Support pref endpoint for ASRouter providers,7/17/2018 7:55,P2,enhancement,5/16/2018 12:58
1465557,Firefox,Activity Streams: Newtab,andrei.br92,RESOLVED,FIXED,AS Router Remote Previewing without a pref,7/16/2018 8:46,P2,normal,5/30/2018 11:12
1468976,Firefox,Activity Streams: Newtab,andrei.br92,RESOLVED,FIXED,Add documentation for AS Router JEXL,7/17/2018 7:55,P2,enhancement,6/15/2018 8:52
1471636,Firefox,Activity Streams: Newtab,andrei.br92,RESOLVED,FIXED,Visual indication that we are previewing a message,9/20/2018 15:14,P2,enhancement,6/27/2018 8:36
1474372,Firefox,Activity Streams: Newtab,andrei.br92,RESOLVED,FIXED,Run our mochi tests on travis,9/17/2018 12:53,P2,normal,7/9/2018 11:06
1476713,Firefox,Activity Streams: Newtab,andrei.br92,RESOLVED,FIXED,Add ASR action for installing an add-on,8/2/2018 2:15,P2,enhancement,7/18/2018 11:19
1477631,Firefox,Activity Streams: Newtab,andrei.br92,RESOLVED,FIXED,Make WHITELIST_HOSTS a pref for development purposes,7/28/2018 9:12,P2,normal,7/23/2018 0:50
1483977,Firefox,Activity Streams: Newtab,andrei.br92,RESOLVED,FIXED,Port BookmarksCount targeting for ASR,9/20/2018 15:14,P2,enhancement,8/16/2018 11:24
1484206,Firefox,Activity Streams: Newtab,andrei.br92,RESOLVED,FIXED,Port previousSessionEnd from snippets feed to ASR,9/20/2018 15:14,P2,enhancement,8/17/2018 6:01
1484207,Firefox,Activity Streams: Newtab,andrei.br92,RESOLVED,FIXED,"Add geo, locale, fx version to ASR targeting",9/20/2018 15:14,P2,enhancement,8/17/2018 6:03
1484698,Firefox,Activity Streams: Newtab,andrei.br92,RESOLVED,FIXED,Rename hasFxAccount to usesFirefoxSync in AS Targeting,9/20/2018 15:14,P2,enhancement,8/20/2018 7:07
1485345,Firefox,Activity Streams: Newtab,andrei.br92,RESOLVED,FIXED,Expose current timestamp as a targeting attribute,8/29/2018 18:12,P2,enhancement,8/22/2018 5:43
1500563,Firefox,Activity Streams: Newtab,andrei.br92,RESOLVED,FIXED,"Update ASR templates to reflect defaults, have 1 schema per template",12/5/2018 12:38,P2,normal,10/19/2018 12:52
1506229,Firefox,Activity Streams: Newtab,andrei.br92,RESOLVED,FIXED,Duplicate files pass ./mach package locally and on taskcluster but fail on try,11/27/2018 9:55,P2,normal,11/9/2018 11:56
1402380,Firefox,Bookmarks & History,arai.unmht,RESOLVED,FIXED,Unexpected Google search is performed with garbage words when drag & drop a bookmarks folder from Library window to tab bar,3/27/2018 12:07,P2,normal,9/22/2017 9:31
1384309,Firefox,General,arthur,RESOLVED,FIXED,"about:support ""Graphics"" section breaks when ""webgl.disable-extensions"" is true",1/13/2018 13:54,P2,normal,7/25/2017 14:59
1442302,Firefox,Bookmarks & History,bdahl,RESOLVED,FIXED,Remove placesOverlay.xul,3/16/2018 3:05,P2,normal,3/1/2018 8:50
1275658,Firefox,Normandy Server,bencase,RESOLVED,FIXED,Validate jexl expressions,1/27/2018 11:11,P2,normal,5/25/2016 11:08
1392352,Firefox,Tabbed Browser,bgrinstead,RESOLVED,FIXED,Migrate the tabbrowser XBL binding to a JS class,10/9/2018 4:42,P2,normal,8/21/2017 11:14
1442582,Firefox,Tabbed Browser,bgrinstead,RESOLVED,FIXED,Remove the tabbrowser-tabpanels binding,9/17/2018 12:49,P2,normal,3/2/2018 4:39
1266483,Firefox,Normandy Server,bstoroz,RESOLVED,FIXED,Generate action configuration forms for arguments_json field,1/27/2018 11:11,P2,normal,4/21/2016 10:22
1266490,Firefox,Normandy Server,bstoroz,RESOLVED,FIXED,"Make recipe list sortable, searchable and filterable",1/27/2018 11:11,P2,normal,4/21/2016 10:31
1269536,Firefox,Normandy Server,bstoroz,RESOLVED,FIXED,Recipe testing view,1/27/2018 11:11,P2,normal,5/2/2016 16:39
1271272,Firefox,Normandy Server,bstoroz,RESOLVED,FIXED,Build route & actions for handling recipe history,1/27/2018 11:11,P2,normal,5/9/2016 6:05
1271274,Firefox,Normandy Server,bstoroz,RESOLVED,FIXED,Validate recipe edit forms,1/27/2018 11:11,P2,normal,5/9/2016 6:06
1271276,Firefox,Normandy Server,bstoroz,RESOLVED,FIXED,Handle API request failures in UI,1/27/2018 11:11,P2,normal,5/9/2016 6:08
1279073,Firefox,Normandy Client,bstoroz,RESOLVED,FIXED,"Add ""message with a button"" heartbeat",1/27/2018 11:10,P2,normal,6/8/2016 15:49
1279084,Firefox,Normandy Client,bstoroz,RESOLVED,FIXED,Cleanup UI and listeners when addon is disabled,1/27/2018 11:10,P2,normal,6/8/2016 15:59
1280197,Firefox,Normandy Client,bstoroz,RESOLVED,FIXED,Add stable sampling JEXL filter to addon driver,1/27/2018 11:10,P2,normal,6/15/2016 2:29
574380,Firefox,Sync,bugzilla,RESOLVED,FIXED,make constants useful on trunk,9/24/2018 14:24,P2,normal,6/24/2010 10:06
577565,Firefox,Sync,bugzilla,RESOLVED,FIXED,"Downgrade log message to trace: ""Store.Forms: WARN: Ignoring form record update request!""",9/24/2018 14:24,P2,trivial,7/8/2010 15:32
1491783,Firefox,General,ccorcoran,RESOLVED,FIXED,Lighten file sharing mode during SignedBinary::VerifySignature,9/18/2018 19:25,P2,normal,9/17/2018 4:00
1486375,Firefox,Activity Streams: Newtab,cegvinoth,RESOLVED,FIXED,Remove eval from Redux.jsm,10/29/2018 8:02,P2,normal,8/27/2018 1:20
1507574,Firefox,Theme,chandranvishwaak,RESOLVED,FIXED,"Color differences between List All Tabs and Open a New Tab buttons, and the '<' & '>' button",11/22/2018 6:09,P2,normal,11/15/2018 11:05
1432992,Firefox,General,continuation,RESOLVED,FIXED,"Remove definitions of Ci, Cr, Cc, and Cu",4/7/2018 13:57,P2,normal,1/24/2018 16:26
1388628,Firefox,Session Restore,dao+bmo,RESOLVED,FIXED,Tabs are all restored as blank frequently,4/15/2018 13:15,P2,major,8/8/2017 22:56
1443849,Firefox,Tabbed Browser,dao+bmo,RESOLVED,FIXED,"Make gBrowser.init more predictable by calling it from  gBrowserInit, prevent early access to gBrowser",3/20/2018 6:03,P2,normal,3/7/2018 9:09
1459887,Firefox,Bookmarks & History,dao+bmo,RESOLVED,FIXED,"Relabel the ""Remove Bookmark"" button to ""Cancel"" in the New Bookmark dialog",7/11/2018 7:46,P2,normal,5/8/2018 4:11
1462166,Firefox,Theme,dao+bmo,RESOLVED,FIXED,Style Bookmark doorhanger buttons like panel footer buttons,7/8/2018 12:25,P2,normal,5/16/2018 15:23
1464489,Firefox,Bookmarks & History,dao+bmo,RESOLVED,FIXED,"When creating a new bookmark, the bookmark panel should be titled ""New Bookmark"" instead of ""Page Bookmarked""",7/2/2018 22:52,P2,normal,5/25/2018 11:11
1465973,Firefox,Theme,dao+bmo,RESOLVED,FIXED,Stop setting font-size: 13px on panel headers,6/5/2018 7:00,P2,normal,5/31/2018 14:32
1466306,Firefox,Theme,dao+bmo,RESOLVED,FIXED,Fix contrast of disabled icons in overflow menu,7/11/2018 7:46,P2,normal,6/2/2018 1:22
1487344,Firefox,Theme,dao+bmo,RESOLVED,FIXED,Add common class for main browser window toolbars and replace #navigator-toolbox > toolbar selectors,8/30/2018 14:57,P2,normal,8/30/2018 3:13
1491249,Firefox,Address Bar,dao+bmo,RESOLVED,FIXED,Port URL tooltip from urlbarBindings.xml to UrlbarInput.jsm,10/4/2018 15:37,P2,normal,9/14/2018 3:47
1491277,Firefox,Address Bar,dao+bmo,RESOLVED,FIXED,Align UrlbarView results with the textbox,11/22/2018 13:50,P2,normal,9/14/2018 5:15
1493343,Firefox,Tabbed Browser,dao+bmo,RESOLVED,FIXED,tab left over after failed tab move between PB/nonPB,10/9/2018 15:08,P2,normal,9/21/2018 18:17
1494274,Firefox,Address Bar,dao+bmo,RESOLVED,FIXED,Port clickSelectsAll and doubleClickSelectsAll behavior from urlbarBindings.xml to UrlbarInput.jsm,9/28/2018 21:22,P2,normal,9/26/2018 4:51
1494334,Firefox,Address Bar,dao+bmo,RESOLVED,FIXED,Implement UrlbarInput::textValue getter,10/25/2018 4:33,P2,normal,9/26/2018 8:42
1496476,Firefox,Address Bar,dao+bmo,RESOLVED,FIXED,"""uncaught exception: Unrecognized urlbar event: TabSelect"" when opening a tab",10/5/2018 14:54,P2,normal,10/4/2018 9:40
1498748,Firefox,Address Bar,dao+bmo,RESOLVED,FIXED,Stop ignoring browser.urlbar.quantumbar in the first window,10/15/2018 15:25,P2,normal,10/12/2018 17:34
1498879,Firefox,Address Bar,dao+bmo,RESOLVED,FIXED,"Cutting in the address bar fails with ""TypeError: urlbar.dispatchEvent is not a function""",10/22/2018 4:45,P2,normal,10/14/2018 0:36
1499652,Firefox,Address Bar,dao+bmo,RESOLVED,FIXED,UrlbarInput: identity popup doesn't open,10/24/2018 15:07,P2,normal,10/17/2018 3:11
1499706,Firefox,Tabbed Browser,dao+bmo,RESOLVED,FIXED,Make TabsInTitlebar.update private,11/8/2018 21:40,P2,normal,10/17/2018 6:35
1501254,Firefox,Theme,dao+bmo,RESOLVED,FIXED,Panel banner items change their text color on hover,10/24/2018 15:33,P2,normal,10/23/2018 5:30
1502455,Firefox,Address Bar,dao+bmo,RESOLVED,FIXED,UrlbarView: add one-off search buttons stub,10/27/2018 3:03,P2,normal,10/26/2018 10:23
1503529,Firefox,Address Bar,dao+bmo,RESOLVED,FIXED,QuantumBar: Implement support for browser.urlbar.openintab preference,12/17/2018 21:26,P2,normal,10/31/2018 4:30
1506113,Firefox,Theme,dao+bmo,RESOLVED,FIXED,Menu Bar and Tab Bar are not visible with High Contrast White Theme when not drawing in the title bar,12/28/2018 21:05,P2,normal,11/9/2018 5:30
1508081,Firefox,Theme,dao+bmo,RESOLVED,FIXED,Make tab line color fallback to the selected tab text color instead of accentcolor,12/3/2018 14:52,P2,normal,11/17/2018 11:56
1512659,Firefox,Address Bar,dao+bmo,RESOLVED,FIXED,Add the star symbol to bookmark matches,12/11/2018 1:15,P2,normal,12/7/2018 7:30
1512747,Firefox,Address Bar,dao+bmo,RESOLVED,FIXED,Add the tab icon to remote tab matches,12/29/2018 2:46,P2,normal,12/7/2018 13:25
1454705,Firefox,Address Bar,dharvey,RESOLVED,FIXED,Can't use share menu from within the address bar,5/10/2018 0:31,P2,normal,4/17/2018 9:48
1476561,Firefox,Site Identity and Permission Panels,dharvey,RESOLVED,FIXED,Autoplay prompt has the wrong icon,9/17/2018 7:17,P2,normal,7/18/2018 4:17
1477350,Firefox,Site Identity and Permission Panels,dharvey,RESOLVED,FIXED,Blocked autoplay icon does not use light colors in dark themes,9/17/2018 7:18,P2,normal,7/20/2018 11:49
1481289,Firefox,Site Identity and Permission Panels,dharvey,RESOLVED,FIXED,URL bar autoplay icon in Firefox is misaligned,9/17/2018 7:19,P2,normal,8/6/2018 11:54
1426705,Firefox,Activity Streams: Newtab,dmose,RESOLVED,FIXED,"Add responsive layout, React 16 and bug fixes to Activity Stream",10/3/2018 10:12,P2,enhancement,12/21/2017 9:01
1445090,Firefox,Activity Streams: Newtab,dmose,RESOLVED,FIXED,Remove strings that are unused at the end of 61,5/5/2018 2:57,P2,enhancement,3/12/2018 16:41
1425144,Firefox,General,dothayer,RESOLVED,FIXED,0.34 severe hangs / khr in CreateFileW while creating jump lists,9/6/2018 16:29,P2,normal,12/13/2017 14:44
532150,Firefox,Session Restore,dteller,RESOLVED,FIXED,session file should be read on a background thread,4/7/2018 17:51,P2,normal,12/1/2009 10:55
1469345,Firefox,Tabbed Browser,dtownsend,RESOLVED,FIXED,Fix favicon tests that are disabled in verify mode,10/26/2018 14:58,P2,normal,6/18/2018 10:36
1472476,Firefox,Session Restore,dtownsend,RESOLVED,FIXED,The first session restore after bug 1453751 causes restored tabs to lose their icons until the pages are loaded,11/26/2018 16:26,P2,normal,6/30/2018 11:24
442880,Firefox,Sync,edilee,RESOLVED,FIXED,"add ""Open All in Tabs"" in ""Tabs From Other Computers"" under the History menu",9/24/2018 14:26,P2,enhancement,7/1/2008 2:16
482906,Firefox,Sync,edilee,RESOLVED,FIXED,Gracefully handle wiping weave passwords if syncing doesn't restore them,9/24/2018 14:26,P2,normal,3/12/2009 0:20
483089,Firefox,Sync,edilee,RESOLVED,FIXED,Weave Preferences button in Add-ons manager should be enabled,9/24/2018 14:26,P2,normal,3/12/2009 16:45
503964,Firefox,Sync,edilee,RESOLVED,FIXED,Have per-engine versioning to avoid wiping all engine data,9/24/2018 14:24,P2,normal,7/13/2009 14:33
512457,Firefox,Sync,edilee,RESOLVED,FIXED,Report errors before they get eaten up by runInBatchMode,9/24/2018 14:24,P2,normal,8/25/2009 7:14
513123,Firefox,Sync,edilee,RESOLVED,FIXED,Fennec Remote Tabs page only shows some of the tabs,9/24/2018 14:26,P2,normal,8/27/2009 16:30
514601,Firefox,Sync,edilee,RESOLVED,FIXED,Don't send DELETE for old history/form data on every sync,9/24/2018 14:24,P2,normal,9/3/2009 20:21
518018,Firefox,Sync,edilee,RESOLVED,FIXED,Default to serverURL instead of userAPI on 404 cluster check,9/24/2018 14:24,P2,normal,9/21/2009 17:18
518022,Firefox,Sync,edilee,RESOLVED,FIXED,"Logging in with invalid username results in ""Couldn't sign in: Network error""",9/24/2018 14:24,P2,normal,9/21/2009 17:32
518077,Firefox,Sync,edilee,RESOLVED,FIXED,"Add custom settings for ""sign in"" to set things like server url",9/24/2018 14:26,P2,normal,9/22/2009 0:50
518972,Firefox,Sync,edilee,RESOLVED,FIXED,Only upload history records that have more than one visit,9/24/2018 14:24,P2,normal,9/25/2009 16:46
522077,Firefox,Sync,edilee,RESOLVED,FIXED,"Download a certain total number of items each sync instead of fixed ""catch up""",9/24/2018 14:24,P2,normal,10/13/2009 11:18
522084,Firefox,Sync,edilee,RESOLVED,FIXED,Automatically sync much sooner if there's more data to fetch from the server,9/24/2018 14:24,P2,normal,10/13/2009 11:55
524052,Firefox,Sync,edilee,RESOLVED,FIXED,Remove about:weave,9/24/2018 14:26,P2,normal,10/22/2009 23:45
524161,Firefox,Sync,edilee,RESOLVED,FIXED,"with weave installed, only three tabs fit in a column (n900)",9/24/2018 14:26,P2,normal,10/23/2009 11:08
524916,Firefox,Sync,edilee,RESOLVED,FIXED,remove any/all code/images/strings that we aren't using anymore,9/24/2018 14:26,P2,normal,10/28/2009 0:47
526391,Firefox,Sync,edilee,RESOLVED,FIXED,Crash [@ nsXULPopupManager::HidePopupsInDocShell(nsIDocShellTreeItem*) ][@ nsMenuPopupFrame::FindMenuWithShortcut] when opening Weave's Activity Log or Preferences from context menu while doing an incremental sync,9/24/2018 14:26,P2,critical,11/3/2009 20:04
530904,Firefox,Sync,edilee,RESOLVED,FIXED,tabs list style doesn't match fennec lists,9/24/2018 14:26,P2,normal,11/24/2009 14:37
530926,Firefox,Sync,edilee,RESOLVED,FIXED,"remove ""Weave /"" from tab list page title",9/24/2018 14:26,P2,normal,11/24/2009 15:47
562100,Firefox,Sync,edilee,RESOLVED,FIXED,need enhanced activity logging to measure sync performance from client,9/24/2018 14:24,P2,enhancement,4/27/2010 11:01
1422289,Firefox,Activity Streams: Newtab,edilee,RESOLVED,FIXED,ContentLinkHandler should guess icon type from the extension when type is not defined,4/9/2018 5:34,P2,normal,12/1/2017 5:01
1432664,Firefox,Activity Streams: Newtab,edilee,RESOLVED,FIXED,Investigate how to move in content prefs to about:preferences,1/29/2018 14:40,P2,enhancement,1/23/2018 16:17
1436228,Firefox,Activity Streams: Newtab,edilee,RESOLVED,FIXED,Green up our JS dependencies for Firefox 61,5/5/2018 12:56,P2,enhancement,2/6/2018 16:46
1436348,Firefox,Activity Streams: Newtab,edilee,RESOLVED,FIXED,Exception running bootstrap method shutdown on activity-stream@mozilla.org,3/30/2018 9:31,P2,normal,2/7/2018 5:51
1446195,Firefox,Activity Streams: Newtab,edilee,RESOLVED,FIXED,Update story preferences description and link,4/14/2018 17:23,P2,enhancement,3/15/2018 15:43
1447891,Firefox,Activity Streams: Newtab,edilee,RESOLVED,FIXED,Top Sites keep changing dramatically,4/27/2018 11:50,P2,normal,3/21/2018 21:34
1447893,Firefox,Activity Streams: Newtab,edilee,RESOLVED,FIXED,about:preferences#home 'Firefox Home Content' cannot uncheck with one click,5/9/2018 7:27,P2,normal,3/21/2018 22:10
1454344,Firefox,Activity Streams: Newtab,edilee,RESOLVED,FIXED,Setting New tabs to |Blank Page| does not become effective until the 2nd new tab,4/26/2018 7:17,P2,normal,4/16/2018 4:55
1496241,Firefox,Activity Streams: Newtab,edilee,RESOLVED,FIXED,Activity Stream doesn't honor default preference set via Autoconfig (and policy),11/3/2018 10:06,P2,normal,10/3/2018 14:39
1498314,Firefox,Activity Streams: Newtab,edilee,RESOLVED,FIXED,"[Export] Add simplified onboarding, CFR installing and bug fixes to Activity Stream",10/11/2018 21:02,P2,enhancement,10/11/2018 11:33
1498462,Firefox,Activity Streams: Newtab,edilee,RESOLVED,FIXED,"[Export] Add Personalization v2, RichText snippets and bug fixes to Activity Stream",10/17/2018 15:10,P2,enhancement,10/11/2018 21:02
1499886,Firefox,Activity Streams: Newtab,edilee,RESOLVED,FIXED,"[Export] Add send-to-device snippet, right-to-left robustness and bug fixes to Activity Stream",10/25/2018 21:04,P2,enhancement,10/17/2018 15:10
1500540,Firefox,Activity Streams: Newtab,edilee,RESOLVED,FIXED,"[Export] Add end-of-year snippet, contextual-feature-recommender preference and bug fixes to Activity Stream",10/26/2018 10:36,P2,enhancement,10/19/2018 12:09
1502461,Firefox,Activity Streams: Newtab,edilee,RESOLVED,FIXED,"[Export] Fix recommendation counts, recommendation alignment and bug fixes to Activity Stream",11/1/2018 13:05,P2,enhancement,10/26/2018 10:36
1504754,Firefox,Activity Streams: Newtab,edilee,RESOLVED,FIXED,Debug noscripts version of new tab page fail to load,11/29/2018 8:56,P2,normal,11/5/2018 9:25
1508407,Firefox,Activity Streams: Newtab,edilee,RESOLVED,FIXED,"[Export] Add Return-to-AMO firstrun, Pocket-personalization attachment and bug fixes to Activity Stream",11/23/2018 12:16,P2,enhancement,11/19/2018 13:19
1510040,Firefox,Activity Streams: Newtab,edilee,RESOLVED,FIXED,"[Export] Add devtool documentation, devdep updates and bug fixes to Activity Stream",11/28/2018 12:39,P2,enhancement,11/26/2018 15:00
1510766,Firefox,Activity Streams: Newtab,edilee,RESOLVED,FIXED,"[Export] Add AMO firstrun, FxA defaults and bug fixes to Activity Stream",12/18/2018 15:25,P2,enhancement,11/28/2018 12:39
1475697,Firefox,Tracking Protection,ehsan,RESOLVED,FIXED,Update the security UI when blocking anything based on the new cookie restrictions,9/19/2018 6:58,P2,normal,7/13/2018 14:38
1484876,Firefox,Tracking Protection,ehsan,RESOLVED,FIXED,Refactor the code responsible for checking whether the top window URI is on the content blocking allow list into AntiTrackingCommon,11/19/2018 15:53,P2,normal,8/20/2018 17:11
1485099,Firefox,Tracking Protection,ehsan,RESOLVED,FIXED,Add some logging to the AntiTracking component for the saving and reading of storage access permissions,8/21/2018 20:41,P2,normal,8/21/2018 11:29
1486414,Firefox,Preferences,ehsan,RESOLVED,FIXED,Add prefs to hide the Trackers and FastBlock categories in the Content Blocking preferences,8/29/2018 14:58,P2,normal,8/27/2018 5:06
1490811,Firefox,Tracking Protection,ehsan,RESOLVED,FIXED,Add a permission doorhanger for storage access,12/30/2018 8:40,P2,normal,9/12/2018 13:39
1491455,Firefox,Site Identity and Permission Panels,ehsan,RESOLVED,FIXED,The Shield icon in the control centre appears to be squished,10/15/2018 22:58,P2,normal,9/14/2018 14:03
1502240,Firefox,Tracking Protection,ehsan,RESOLVED,FIXED,Ensure that Content Blocking allow list is applied to all cookie policies,12/20/2018 8:07,P2,normal,10/25/2018 16:51
1503074,Firefox,Tabbed Browser,ehsan,RESOLVED,FIXED,"Intermittent browser/components/payments/test/browser/<random_test> | [JavaScript Error: ""TelemetryStopwatch: requesting elapsed time for nonexisting stopwatch. Histogram: ""FX_TAB_SWITCH_COMPOSITE_E10S_MS"", key: ""null"""" {file: ""resource:",11/27/2018 20:17,P2,normal,10/29/2018 18:57
1503697,Firefox,Tracking Protection,ehsan,RESOLVED,FIXED,Record whether trackers are loaded on a site in the content blocking log,11/6/2018 2:08,P2,normal,10/31/2018 14:04
1505198,Firefox,Tracking Protection,ehsan,RESOLVED,FIXED,Make sure the STATE_COOKIES_LOADED state is stored outside of the content blocking log,12/5/2018 12:51,P2,normal,11/6/2018 14:27
1506947,Firefox,Tracking Protection,ehsan,RESOLVED,FIXED,Add a pref for site-specific workarounds for blocking cookies from trackers,11/29/2018 10:34,P2,normal,11/13/2018 11:49
